{
  "id": "CL-WO-033",
  "document_kind": "planning_work_order_candidate",
  "status": "not_admitted",
  "proposed_phase": "P06",
  "complexity": "medium",
  "scheduling": {
    "depends_on": [
      "CL-WO-031",
      "CL-WO-032"
    ],
    "parallelizable": "conditional_if_nonoverlapping_writes_locks_and_all_predecessors_admitted",
    "out_of_order": "conditional_if_all_dependencies_and_authority_are_satisfied",
    "exclusive_write_roots": [
      "grafana/provisioning/alerting/",
      "tests/alerts/notification/"
    ],
    "exclusive_resource_locks": [
      "notifications"
    ],
    "isolation": "Use isolated Docker Compose project, credentials and data volumes for concurrent tests"
  },
  "A_identity_outcome": {
    "id": "CL-WO-033",
    "canonical_domain_owner": "cl.owner.alert.v1",
    "required_results": "Provide configured email/webhook routing and observable failed delivery.",
    "requirements": [
      "cl.req.028.v1",
      "cl.req.025.v1"
    ],
    "invariants": [
      "cl.invariant.alerts.v1",
      "cl.invariant.coverage.v1"
    ],
    "product_edges": [
      "cl.flow.008.v1",
      "cl.flow.016.v1",
      "cl.flow.017.v1"
    ]
  },
  "B_authoritative_context": {
    "exact_source": {
      "repo": "mjgolaszewski/clauditor",
      "baseline_git_commit": "44ca22d86ea15b6c9e76d84217cbabf37bd5cda9",
      "model_git_blob": "3e516bcb3468ebbbb03a08ec4309e226e1c3a14b",
      "registry_git_blob": "dcb679edb51132b4954fd5eabb12c0db64134c3b",
      "bcf": "v2.3.6 Lite; proposed Standard 3.0 controller-free"
    },
    "requirements": [
      {
        "id": "cl.req.028.v1",
        "source_refs": [
          "U12"
        ],
        "source_pointer": "spec/clauditor/v1/model.json#/requirements/27",
        "positive": "Test alert reaches configured channel",
        "negative": "Notification failure cannot be marked delivered"
      },
      {
        "id": "cl.req.025.v1",
        "source_refs": [
          "U12",
          "OTRES"
        ],
        "source_pointer": "spec/clauditor/v1/model.json#/requirements/24",
        "positive": "Injected queue failure triggers alert",
        "negative": "Silence is not falsely interpreted as inactivity"
      }
    ],
    "canonical_refs": [
      "spec/clauditor/v1/model.json",
      "spec/clauditor/v1/source-registry.json",
      "spec/clauditor/v1/bcf-binding.json",
      "AGENTS.yml",
      "plans/product-spec.yml",
      "governance/gate-contracts.yml"
    ],
    "predecessor_outputs": [
      {
        "order_id": "CL-WO-031",
        "required_artifact_id": "CL-WO-031:primary",
        "artifact_path": "grafana/alerts/health/pipeline.yaml",
        "qualification": "exact authenticated output identity required; not yet assigned"
      },
      {
        "order_id": "CL-WO-032",
        "required_artifact_id": "CL-WO-032:primary",
        "artifact_path": "grafana/alerts/compliance/rules.yaml",
        "qualification": "exact authenticated output identity required; not yet assigned"
      }
    ],
    "shared_context": "spec/clauditor/v1/construction/context.json"
  },
  "C_preconditions_readiness": {
    "dependency_ids": [
      "CL-WO-031",
      "CL-WO-032"
    ],
    "consumed_predecessor_outputs": [
      {
        "order_id": "CL-WO-031",
        "required_artifact_id": "CL-WO-031:primary",
        "artifact_path": "grafana/alerts/health/pipeline.yaml",
        "qualification": "exact authenticated output identity required; not yet assigned"
      },
      {
        "order_id": "CL-WO-032",
        "required_artifact_id": "CL-WO-032:primary",
        "artifact_path": "grafana/alerts/compliance/rules.yaml",
        "qualification": "exact authenticated output identity required; not yet assigned"
      }
    ],
    "blockers": [
      "Product contracts remain a review candidate; authorized implementation requires exact BCF dependency and owner admission",
      "Missing source/user decisions or an unqualified exporter prevent claims dependent on that source",
      "Changed source blob, BCF version, predecessor receipt or runtime environment requires affected revalidation"
    ],
    "authority": "No construction on basis of this candidate packet; require current canonical BCF and owner admission",
    "drift_policy": "Fail closed on changed source, contract, test population, provider or authority and requalify affected dependencies"
  },
  "D_proposed_permitted_cut": {
    "write_roots": [
      "grafana/provisioning/alerting/",
      "tests/alerts/notification/"
    ],
    "primary_output": "grafana/provisioning/alerting/contact-points.yaml",
    "allowed_edits": "Only owner-approved bounded files and directly necessary tests",
    "forbidden_edits": [
      "Other owners' contracts, unrelated product features and uncontrolled dependency upgrades",
      "Generated .github/workflows, forged BCF evidence or authored verified/closed",
      "Chrysalis/Entra/Compliance API and paid hosted services in MVP"
    ]
  },
  "E_behavioral_contract": {
    "inputs": [
      "Applicable source/operation contracts and the exact read-set",
      "CL-WO-031:primary",
      "CL-WO-032:primary"
    ],
    "outputs": [
      "CL-WO-033:primary"
    ],
    "preconditions": [
      "Owner and source contract resolve",
      "All producer-consumer edges and state transitions classified"
    ],
    "success": "Approved destination receives tested alert and recovery",
    "rejection": "Failed webhook cannot be recorded as delivered",
    "edge_refs": [
      "cl.flow.008.v1",
      "cl.flow.016.v1",
      "cl.flow.017.v1"
    ],
    "side_effect_scope": [
      "grafana/provisioning/alerting/",
      "tests/alerts/notification/"
    ],
    "concurrency": "Exact input and exclusive writer; no silent sharing of state/queues",
    "recovery": "Typed rejection, bounded replay or explicit operator reconciliation",
    "migration": "Preserve historical source field, role, consent, archive and BCF behavior unless owner supersedes it"
  },
  "F_implementation_approach": {
    "ordered_steps": [
      "Provision recipient secrets outside committed config",
      "test de-dup, ack, retry and rejected webhook"
    ],
    "reuse": [
      "Canonical Anthropic/OTLP interfaces and BCF owners",
      "Qualified free self-hosted Collector/ClickHouse/Grafana components before custom code"
    ],
    "scope_limit": "Do not define missing business semantics while coding; report upstream contract blockers"
  },
  "G_positive_negative_proof": {
    "positive": [
      "Approved destination receives tested alert and recovery",
      "Test alert reaches configured channel",
      "Injected queue failure triggers alert"
    ],
    "negative": [
      "Failed webhook cannot be recorded as delivered",
      "Notification failure cannot be marked delivered",
      "Silence is not falsely interpreted as inactivity"
    ],
    "preservation": [
      "Previously accepted input/output schema and historical protections",
      "BCF Lite root controls and source/hero files"
    ],
    "test_roots": [
      "tests/alerts/notification/"
    ],
    "result": "not_run"
  },
  "H_validation_evidence": {
    "cheap_preflight": [
      "python3 spec/clauditor/v1/tools/check.py --self-test",
      "python3 spec/clauditor/v1/construction/tools/check.py --self-test"
    ],
    "root_existing": [
      "python3 scripts/validate_governance_yaml.py --repo-root .",
      "python3 scripts/check_governance_exposure.py --repo-root ."
    ],
    "target_tests": "Implement the exact scoped positive/negative tests under G; determine invocation from actual test runner during admission, not fabricated now",
    "claims": [
      "cl.invariant.alerts.v1",
      "cl.invariant.coverage.v1"
    ],
    "evidence_binding": "Exact candidate Git blob/tree, dependency and source manifests, actor/runner authority, test case population and observation context",
    "cost_order": "Schema/edge/preflight → cheap deterministic → scoped tests → required live/provider validation → BCF evidence qualification",
    "reuse": "Qualified unchanged evidence only if dependency fingerprint, freshness, source and BCF authority still apply; no automatic generic rerun"
  },
  "I_discretion_stop": {
    "allowed": [
      "Ordinary coding/tool configuration details within accepted effect, schema, security, privacy and budget contracts",
      "Use OSS built-in functionality before proposing a custom helper"
    ],
    "prohibited": [
      "Choosing a different retention or missing-content meaning",
      "Changing canonical domain laws, root BCF authority, source material or deployment scope without amendment"
    ],
    "stop": [
      "Product contracts remain a review candidate; authorized implementation requires exact BCF dependency and owner admission",
      "Missing source/user decisions or an unqualified exporter prevent claims dependent on that source",
      "Changed source blob, BCF version, predecessor receipt or runtime environment requires affected revalidation"
    ],
    "execution_budget": "Must be derived from qualified host/source budgets before active work; no invented provider quota"
  },
  "J_completion_handoff": {
    "primary_output": {
      "id": "CL-WO-033:primary",
      "path": "grafana/provisioning/alerting/contact-points.yaml",
      "status": "future_not_built"
    },
    "evidence": "Observed positive/negative proofs with authenticated exact-input receipts where required",
    "downstream_dependents": [
      "CL-WO-040",
      "CL-WO-041",
      "CL-WO-042"
    ],
    "terminal": "bounded_candidate_output_followed_by_explicit_BCF_and_human_admission",
    "no_implicit_authority": [
      "No implied commit/push/merge/deploy/release",
      "Passing this isolated packet does not establish integrated product behavior"
    ]
  }
}
