{
  "id": "CL-WO-001",
  "document_kind": "planning_work_order_candidate",
  "status": "not_admitted",
  "proposed_phase": "P02",
  "complexity": "medium",
  "scheduling": {
    "depends_on": [],
    "parallelizable": "conditional_if_nonoverlapping_writes_locks_and_all_predecessors_admitted",
    "out_of_order": "conditional_if_all_dependencies_and_authority_are_satisfied",
    "exclusive_write_roots": [
      "spec/clauditor/v1/construction/authority/"
    ],
    "exclusive_resource_locks": [
      "owner-review"
    ],
    "isolation": "Use isolated Docker Compose project, credentials and data volumes for concurrent tests"
  },
  "A_identity_outcome": {
    "id": "CL-WO-001",
    "canonical_domain_owner": "cl.owner.governance.v1",
    "required_results": "Bind owner intent, baseline and change authority before constructing dependent contracts.",
    "requirements": [
      "cl.req.029.v1",
      "cl.req.030.v1",
      "cl.req.037.v1",
      "cl.req.038.v1"
    ],
    "invariants": [
      "cl.invariant.authority.v1",
      "cl.invariant.edge_closure.v1",
      "cl.invariant.state_closure.v1"
    ],
    "product_edges": []
  },
  "B_authoritative_context": {
    "exact_source": {
      "repo": "mjgolaszewski/clauditor",
      "baseline_git_commit": "44ca22d86ea15b6c9e76d84217cbabf37bd5cda9",
      "model_git_blob": "3e516bcb3468ebbbb03a08ec4309e226e1c3a14b",
      "registry_git_blob": "dcb679edb51132b4954fd5eabb12c0db64134c3b",
      "bcf": "v2.3.6 Lite; proposed Standard 3.0 controller-free"
    },
    "requirements": [
      {
        "id": "cl.req.029.v1",
        "source_refs": [
          "U02"
        ],
        "source_pointer": "spec/clauditor/v1/model.json#/requirements/28",
        "positive": "Future adapter has independent source boundary",
        "negative": "No Compliance API calls in MVP"
      },
      {
        "id": "cl.req.030.v1",
        "source_refs": [
          "BCF"
        ],
        "source_pointer": "spec/clauditor/v1/model.json#/requirements/29",
        "positive": "Each future construction task has verified prerequisites",
        "negative": "Spec cannot mark BCF verified or release ready"
      },
      {
        "id": "cl.req.037.v1",
        "source_refs": [
          "BCF"
        ],
        "source_pointer": "spec/clauditor/v1/model.json#/requirements/36",
        "positive": "Every pair mechanically closed",
        "negative": "Deleting required route+contract cannot manufacture exclusion"
      },
      {
        "id": "cl.req.038.v1",
        "source_refs": [
          "BCF"
        ],
        "source_pointer": "spec/clauditor/v1/model.json#/requirements/37",
        "positive": "Every state/event cell classified",
        "negative": "Missing transition cannot silently become a valid effect"
      }
    ],
    "canonical_refs": [
      "spec/clauditor/v1/model.json",
      "spec/clauditor/v1/source-registry.json",
      "spec/clauditor/v1/bcf-binding.json",
      "AGENTS.yml",
      "plans/product-spec.yml",
      "governance/gate-contracts.yml"
    ],
    "predecessor_outputs": [],
    "shared_context": "spec/clauditor/v1/construction/context.json"
  },
  "C_preconditions_readiness": {
    "dependency_ids": [],
    "consumed_predecessor_outputs": [],
    "blockers": [
      "Product contracts remain a review candidate; authorized implementation requires exact BCF dependency and owner admission",
      "Missing source/user decisions or an unqualified exporter prevent claims dependent on that source",
      "Changed source blob, BCF version, predecessor receipt or runtime environment requires affected revalidation"
    ],
    "authority": "No construction on basis of this candidate packet; require current canonical BCF and owner admission",
    "drift_policy": "Fail closed on changed source, contract, test population, provider or authority and requalify affected dependencies"
  },
  "D_proposed_permitted_cut": {
    "write_roots": [
      "spec/clauditor/v1/construction/authority/"
    ],
    "primary_output": "spec/clauditor/v1/construction/authority/decisions.json",
    "allowed_edits": "Only owner-approved bounded files and directly necessary tests",
    "forbidden_edits": [
      "Other owners' contracts, unrelated product features and uncontrolled dependency upgrades",
      "Generated .github/workflows, forged BCF evidence or authored verified/closed",
      "Chrysalis/Entra/Compliance API and paid hosted services in MVP"
    ]
  },
  "E_behavioral_contract": {
    "inputs": [
      "Applicable source/operation contracts and the exact read-set"
    ],
    "outputs": [
      "CL-WO-001:primary"
    ],
    "preconditions": [
      "Owner and source contract resolve",
      "All producer-consumer edges and state transitions classified"
    ],
    "success": "Every requirement has accountable intent/disposition or explicit blocker",
    "rejection": "Agent guesses cannot resolve missing stakeholder policy",
    "edge_refs": [],
    "side_effect_scope": [
      "spec/clauditor/v1/construction/authority/"
    ],
    "concurrency": "Exact input and exclusive writer; no silent sharing of state/queues",
    "recovery": "Typed rejection, bounded replay or explicit operator reconciliation",
    "migration": "Preserve historical source field, role, consent, archive and BCF behavior unless owner supersedes it"
  },
  "F_implementation_approach": {
    "ordered_steps": [
      "Reconcile 39 source requirements with decisions",
      "record unresolved owner approvals and exact canonical BCF constraints"
    ],
    "reuse": [
      "Canonical Anthropic/OTLP interfaces and BCF owners",
      "Qualified free self-hosted Collector/ClickHouse/Grafana components before custom code"
    ],
    "scope_limit": "Do not define missing business semantics while coding; report upstream contract blockers"
  },
  "G_positive_negative_proof": {
    "positive": [
      "Every requirement has accountable intent/disposition or explicit blocker",
      "Future adapter has independent source boundary",
      "Each future construction task has verified prerequisites",
      "Every pair mechanically closed",
      "Every state/event cell classified"
    ],
    "negative": [
      "Agent guesses cannot resolve missing stakeholder policy",
      "No Compliance API calls in MVP",
      "Spec cannot mark BCF verified or release ready",
      "Deleting required route+contract cannot manufacture exclusion",
      "Missing transition cannot silently become a valid effect"
    ],
    "preservation": [
      "Previously accepted input/output schema and historical protections",
      "BCF Lite root controls and source/hero files"
    ],
    "test_roots": [],
    "result": "not_run"
  },
  "H_validation_evidence": {
    "cheap_preflight": [
      "python3 spec/clauditor/v1/tools/check.py --self-test",
      "python3 spec/clauditor/v1/construction/tools/check.py --self-test"
    ],
    "root_existing": [
      "python3 scripts/validate_governance_yaml.py --repo-root .",
      "python3 scripts/check_governance_exposure.py --repo-root ."
    ],
    "target_tests": "Implement the exact scoped positive/negative tests under G; determine invocation from actual test runner during admission, not fabricated now",
    "claims": [
      "cl.invariant.authority.v1",
      "cl.invariant.edge_closure.v1",
      "cl.invariant.state_closure.v1"
    ],
    "evidence_binding": "Exact candidate Git blob/tree, dependency and source manifests, actor/runner authority, test case population and observation context",
    "cost_order": "Schema/edge/preflight → cheap deterministic → scoped tests → required live/provider validation → BCF evidence qualification",
    "reuse": "Qualified unchanged evidence only if dependency fingerprint, freshness, source and BCF authority still apply; no automatic generic rerun"
  },
  "I_discretion_stop": {
    "allowed": [
      "Ordinary coding/tool configuration details within accepted effect, schema, security, privacy and budget contracts",
      "Use OSS built-in functionality before proposing a custom helper"
    ],
    "prohibited": [
      "Choosing a different retention or missing-content meaning",
      "Changing canonical domain laws, root BCF authority, source material or deployment scope without amendment"
    ],
    "stop": [
      "Product contracts remain a review candidate; authorized implementation requires exact BCF dependency and owner admission",
      "Missing source/user decisions or an unqualified exporter prevent claims dependent on that source",
      "Changed source blob, BCF version, predecessor receipt or runtime environment requires affected revalidation"
    ],
    "execution_budget": "Must be derived from qualified host/source budgets before active work; no invented provider quota"
  },
  "J_completion_handoff": {
    "primary_output": {
      "id": "CL-WO-001:primary",
      "path": "spec/clauditor/v1/construction/authority/decisions.json",
      "status": "future_not_built"
    },
    "evidence": "Observed positive/negative proofs with authenticated exact-input receipts where required",
    "downstream_dependents": [
      "CL-WO-004",
      "CL-WO-005"
    ],
    "terminal": "bounded_candidate_output_followed_by_explicit_BCF_and_human_admission",
    "no_implicit_authority": [
      "No implied commit/push/merge/deploy/release",
      "Passing this isolated packet does not establish integrated product behavior"
    ]
  }
}
